{
  "$schema": "./bootstrap-assets.schema.json",
  "version": 1,
  "cdn_base_env": "PODCAST_BOOTSTRAP_CDN_BASE",
  "cdn_base_default": null,
  "assets": {
    "whisper-base": {
      "kind": "huggingface",
      "repo": "Systran/faster-whisper-base",
      "revision": "main",
      "license": "MIT",
      "cdn_prefix": "models/whisper-base",
      "notes": "Pin to a commit SHA before shipping consumer builds; keep LICENSE in the mirror."
    },
    "whisper-large-v3-turbo": {
      "kind": "huggingface",
      "repo": "Systran/faster-whisper-large-v3-turbo",
      "revision": "main",
      "license": "MIT",
      "cdn_prefix": "models/whisper-large-v3-turbo",
      "notes": "Product default; pin revision + per-file sha256 in funnel mirror before consumer SLA."
    },
    "rnnoise": {
      "kind": "http",
      "url": "https://raw.githubusercontent.com/GregorR/rnnoise-models/3eee541a283fd3b8f81b85b1748e3b9ccbefa04d/somnolent-hogwash-2018-09-01/sh.rnnn",
      "sha256": "70bb6685eb0c2a1d18e2918dca3fbfbd39317010b1802eb1b6ea73a92f3fdec0",
      "size_bytes": 297646,
      "revision_note": "Commit-pinned (GregorR/rnnoise-models 3eee541a, same bytes as master at pin time). Change url, sha256 and size_bytes together after re-fetching and hashing.",
      "license": "BSD-style (RNNoise)",
      "cdn_prefix": "models/rnnoise",
      "filename": "somnolent-hogwash.rnnn"
    },
    "speaker-ecapa": {
      "kind": "http",
      "license": "Apache-2.0 (SpeechBrain spkrec-ecapa-voxceleb)",
      "cdn_prefix": "models/speaker-ecapa",
      "filename": "ecapa-voxceleb-embedding.onnx",
      "sha256": "1a310d0e6fe231c623a6bf2a3e115c6ac70df08cf19a91380663d60c01820a82",
      "notes": "ONNX export of the embedding_model at speechbrain/spkrec-ecapa-voxceleb 0f99f2d0, made by scripts/export_ecapa_onnx.py. No upstream URL: publish the exported file to the CDN prefix before the first release that offers it."
    }
  },
  "fallback": {
    "whisper": "huggingface_hub / faster-whisper default download",
    "rnnoise": "GitHub raw URL via util.model_assets",
    "speaker-ecapa": "none; the file is mirrored on the CDN only"
  }
}
